{
  "schemaVersion": "1.0",
  "corpusID": "appear-c-visual-grid-artwork",
  "sourceKind": "simulatorFixture",
  "producer": {
    "name": "TVTestRig",
    "buildReference": "fb47e39a084a2ff20cdf34b85458f1e1ebbdca8a-dirty",
    "producerBuild": "1"
  },
  "requestedTarget": null,
  "observedSource": {
    "assurance": "reported-source; not-attested",
    "captureMethod": "simctl-explicit-uuid",
    "collectedAt": 811834196.255546,
    "fixture": {
      "app_build": "1",
      "app_version": "1.0",
      "fixture_instance_id": "DA147CEE-297A-4297-B755-3FE8940C8793",
      "fixture_run_id": "04290340-2689-4C26-9846-83A98406FCAA",
      "is_bold_text_enabled": false,
      "is_darker_system_colors_status": false,
      "is_reduce_motion_enabled": false,
      "is_switch_control_running": false,
      "is_voice_over_running": false,
      "model": "Apple TV",
      "monotonic_nanoseconds": 22771413997833,
      "os_version": "tvOS 26.5",
      "schema_version": 1,
      "screen_bounds": [
        0,
        0,
        1920,
        1080
      ],
      "screen_scale": 2
    },
    "requestedDeviceID": "2BAA6307-6F24-4820-8292-851BCD311417"
  },
  "eligibility": {
    "inspection": "passed",
    "simulatorUse": "pending-corpus-review",
    "physicalQualification": "not-established",
    "generalTrainingApproval": false
  },
  "pairs": [
    {
      "pairID": "synth-0",
      "recipeGroup": "seed:7",
      "split": "train",
      "originalFamily": "grid_matrix",
      "family": "gridMatrix",
      "originalTheme": "dark",
      "theme": "dark",
      "unfocused": {
        "path": "synth-0_unfocused.png",
        "sha256": "962b77ea4aac3ae1fddad902d26d9ff8d9d19868d2f3901f41e46073944751e9"
      },
      "focused": {
        "path": "synth-0_focused.png",
        "sha256": "677d816e21fb60ce097cb4fc6176a13a616931d5016cc23954d2eba877ea193c"
      },
      "elements": [
        {
          "element_id": "grid_cell_0_0",
          "is_focused": true,
          "normalized_bounds": [
            0.2520833333333333,
            0.41574074074074074,
            0.36666666666666664,
            0.6101851851851852
          ],
          "pixel_bounds": [
            968,
            898,
            440,
            420
          ],
          "taxonomy_class": "collectionItem"
        },
        {
          "element_id": "grid_cell_0_1",
          "is_focused": false,
          "normalized_bounds": [
            0.37916666666666665,
            0.41574074074074074,
            0.49375,
            0.6101851851851852
          ],
          "pixel_bounds": [
            1456,
            898,
            440,
            420
          ],
          "taxonomy_class": "collectionItem"
        },
        {
          "element_id": "grid_cell_1_0",
          "is_focused": false,
          "normalized_bounds": [
            0.50625,
            0.41574074074074074,
            0.6208333333333333,
            0.6101851851851852
          ],
          "pixel_bounds": [
            1944,
            898,
            440,
            420
          ],
          "taxonomy_class": "collectionItem"
        },
        {
          "element_id": "grid_cell_1_1",
          "is_focused": false,
          "normalized_bounds": [
            0.6333333333333333,
            0.41574074074074074,
            0.7479166666666667,
            0.6101851851851852
          ],
          "pixel_bounds": [
            2432,
            898,
            440,
            420
          ],
          "taxonomy_class": "collectionItem"
        }
      ],
      "sidecarVersion": 2,
      "observationBinding": {
        "schemaVersion": 2,
        "correlation": "validated_capture_bracket",
        "baselineScene": {
          "elements": [
            {
              "element_id": "grid_cell_0_0",
              "is_focused": false,
              "normalized_bounds": [
                0.2520833333333333,
                0.41574074074074074,
                0.36666666666666664,
                0.6101851851851852
              ],
              "pixel_bounds": [
                968,
                898,
                440,
                420
              ],
              "taxonomy_class": "collectionItem"
            },
            {
              "element_id": "grid_cell_0_1",
              "is_focused": false,
              "normalized_bounds": [
                0.37916666666666665,
                0.41574074074074074,
                0.49375,
                0.6101851851851852
              ],
              "pixel_bounds": [
                1456,
                898,
                440,
                420
              ],
              "taxonomy_class": "collectionItem"
            },
            {
              "element_id": "grid_cell_1_0",
              "is_focused": false,
              "normalized_bounds": [
                0.50625,
                0.41574074074074074,
                0.6208333333333333,
                0.6101851851851852
              ],
              "pixel_bounds": [
                1944,
                898,
                440,
                420
              ],
              "taxonomy_class": "collectionItem"
            },
            {
              "element_id": "grid_cell_1_1",
              "is_focused": false,
              "normalized_bounds": [
                0.6333333333333333,
                0.41574074074074074,
                0.7479166666666667,
                0.6101851851851852
              ],
              "pixel_bounds": [
                2432,
                898,
                440,
                420
              ],
              "taxonomy_class": "collectionItem"
            }
          ],
          "focus_observation": {
            "generation": 2,
            "geometrySource": "uikit_window_converted_bounds",
            "plannedFocusIDs": [
              "grid_cell_0_0",
              "grid_cell_1_0",
              "grid_cell_1_1"
            ],
            "source": "uikit_focus_system",
            "verified": true
          },
          "harvest_challenge_active": false,
          "is_settled": true,
          "monotonic_nanoseconds": 22777016951083,
          "observation_diagnostics": {
            "generation": 2,
            "measuredIDs": [
              "grid_cell_0_0",
              "grid_cell_0_1",
              "grid_cell_1_0",
              "grid_cell_1_1"
            ],
            "missingIDs": [],
            "nativeFocusResolved": true,
            "nativeProbe": {
              "focusSystemAvailable": true,
              "focusedItemKind": "view",
              "geometryAvailable": true,
              "geometrySource": "uikit_window_converted_bounds",
              "referenceAttached": true,
              "referenceFocusable": true,
              "referenceFocused": true,
              "resolution": "identifier"
            },
            "reason": "ready",
            "requiredIDs": [
              "grid_cell_0_0",
              "grid_cell_1_0",
              "grid_cell_1_1"
            ],
            "requiredMilliseconds": 150,
            "sampleAgeMilliseconds": 19.673166669235798,
            "sampleCount": 54,
            "sampledGeneration": 2,
            "stableMilliseconds": 5249.8842916647845
          },
          "recipe": {
            "appearance": {
              "layout": "standard",
              "preset": "artwork",
              "version": 1
            },
            "archetype": "grid_matrix",
            "density": "regular",
            "element_count": 4,
            "recipe_hash": "e54a55acf191e4b123451fdcf562f4b38152a9c469dbad2d6d74457403dd9b7a",
            "schema_version": 1,
            "seed": 7,
            "step_index": 0,
            "theme": "dark"
          },
          "scene_height": 2160,
          "scene_width": 3840,
          "schema_version": 1,
          "timestamp": 1790141401.851253
        },
        "focusedScene": {
          "elements": [
            {
              "element_id": "grid_cell_0_0",
              "is_focused": true,
              "normalized_bounds": [
                0.2520833333333333,
                0.41574074074074074,
                0.36666666666666664,
                0.6101851851851852
              ],
              "pixel_bounds": [
                968,
                898,
                440,
                420
              ],
              "taxonomy_class": "collectionItem"
            },
            {
              "element_id": "grid_cell_0_1",
              "is_focused": false,
              "normalized_bounds": [
                0.37916666666666665,
                0.41574074074074074,
                0.49375,
                0.6101851851851852
              ],
              "pixel_bounds": [
                1456,
                898,
                440,
                420
              ],
              "taxonomy_class": "collectionItem"
            },
            {
              "element_id": "grid_cell_1_0",
              "is_focused": false,
              "normalized_bounds": [
                0.50625,
                0.41574074074074074,
                0.6208333333333333,
                0.6101851851851852
              ],
              "pixel_bounds": [
                1944,
                898,
                440,
                420
              ],
              "taxonomy_class": "collectionItem"
            },
            {
              "element_id": "grid_cell_1_1",
              "is_focused": false,
              "normalized_bounds": [
                0.6333333333333333,
                0.41574074074074074,
                0.7479166666666667,
                0.6101851851851852
              ],
              "pixel_bounds": [
                2432,
                898,
                440,
                420
              ],
              "taxonomy_class": "collectionItem"
            }
          ],
          "focus_observation": {
            "generation": 3,